{"action": "expand-skills-batch-ai-robotics-v1.1.0", "agent": "skill-implementer", "approval": {"human_review_required": false}, "id": "batch-ai-robotics-001", "inputs": ["skills/edge-ai SKILL.md stub", "skills/robotics SKILL.md stub", "skills/ai-validation SKILL.md stub", "phase2-findings (MLPerf, ONNX, ROS 2 distros)"], "outputs": ["edge-ai v1.1.0", "robotics v1.1.0", "ai-validation v1.1.0"], "source_baseline": "git HEAD pre-expansion", "verification": {"axiom_cli_repo_validate": "PASS", "pytest": "6 passed", "verify_skill": "PASS x3"}}
