{"action": "expand-skills-batch-assurance-v1.1.0", "agent": "skill-implementer", "approval": {"human_review_required": false}, "id": "batch-assurance-001", "inputs": ["validation stub", "coverage stub", "traceability stub"], "outputs": ["validation v1.1.0", "coverage v1.1.0", "traceability v1.1.0"], "source_baseline": "git HEAD pre-expansion", "verification": {"axiom_cli_repo_validate": "PASS", "pytest": "6 passed", "verify_skill": "PASS x3"}}
