{"action": "expand-skills-batch-lifecycle-infra-v1.1.0", "agent": "skill-implementer", "approval": {"human_review_required": false}, "id": "batch-lifecycle-infra-001", "inputs": ["evidence stub", "change-impact stub", "requirements-traceability stub"], "outputs": ["evidence v1.1.0", "change-impact v1.1.0", "requirements-traceability v1.1.0"], "source_baseline": "git HEAD pre-expansion", "verification": {"axiom_cli_repo_validate": "PASS", "pytest": "6 passed", "verify_skill": "PASS x3"}}
