{"action": "expand-skills-batch-vmodel-right-v1.1.0", "agent": "skill-implementer", "approval": {"human_review_required": false}, "id": "batch-vmodel-right-001", "inputs": ["unit-test stub", "integration-test stub", "system-test stub"], "outputs": ["unit-test v1.1.0", "integration-test v1.1.0", "system-test v1.1.0"], "source_baseline": "git HEAD pre-expansion", "verification": {"axiom_cli_repo_validate": "PASS", "pytest": "6 passed", "verify_skill": "PASS x3"}}
