{"action": "expand-skills-batch-assurance-review-v1.1.0", "agent": "skill-implementer", "approval": {"human_review_required": false}, "id": "batch-assurance-review-001", "inputs": ["static-analysis stub", "code-review stub", "debugging stub"], "outputs": ["static-analysis v1.1.0", "code-review v1.1.0", "debugging v1.1.0"], "source_baseline": "git HEAD pre-expansion", "verification": {"axiom_cli_repo_validate": "PASS", "pytest": "6 passed", "verify_skill": "PASS x3"}}
