{"action": "universal-client-interfaces-v1", "agent": "skill-implementer", "approval": {"human_review_required": false}, "id": "feature-interfaces-001", "inputs": ["11-client x 5-interface requirement", "packages/axiom_sdk engage/run_plan", "stdlib-only constraint"], "outputs": ["packages/axiom_sdk", "packages/axiom_mcp/server.py", "packages/axiom_server/server.py (REST+A2A)", "axiom mcp|serve CLI", "clients/mcp.json+README+COPILOT+CURSOR", "docs/client-matrix.md", "docs/adr/0005", "tests/test_interfaces.py (5 tests)"], "source_baseline": "git HEAD pre-feature", "verification": {"axiom_cli_doctor": "PASS", "axiom_cli_repo_validate": "PASS", "pytest": "15 passed"}}
