{"action": "expand-skills-batch-arch-sim-v1.1.0", "agent": "skill-implementer", "approval": {"human_review_required": false}, "id": "batch-arch-sim-001", "inputs": ["hardware-architecture stub", "software-architecture stub", "simulation stub"], "outputs": ["hardware-architecture v1.1.0", "software-architecture v1.1.0", "simulation v1.1.0"], "source_baseline": "git HEAD pre-expansion", "verification": {"axiom_cli_repo_validate": "PASS", "pytest": "6 passed", "verify_skill": "PASS x3"}}
