{"action": "expand-skills-batch-firmware-base-v1.1.0", "agent": "skill-implementer", "approval": {"human_review_required": false}, "id": "batch-firmware-base-001", "inputs": ["bare-metal stub", "bootloader stub", "drivers stub"], "outputs": ["bare-metal v1.1.0", "bootloader v1.1.0", "drivers v1.1.0"], "source_baseline": "git HEAD pre-expansion", "verification": {"axiom_cli_repo_validate": "PASS", "pytest": "6 passed", "verify_skill": "PASS x3"}}
