{"action": "expand-skills-batch-vmodel-left-v1.1.0", "agent": "skill-implementer", "approval": {"human_review_required": false}, "id": "batch-vmodel-left-001", "inputs": ["requirements stub", "architecture stub", "implementation stub"], "outputs": ["requirements v1.1.0", "architecture v1.1.0", "implementation v1.1.0"], "source_baseline": "git HEAD pre-expansion", "verification": {"axiom_cli_repo_validate": "PASS", "pytest": "6 passed", "verify_skill": "PASS x3"}}
