{"action": "expand-skills-batch-feature-legacy-audit-v1.1.0", "agent": "skill-implementer", "approval": {"human_review_required": false}, "id": "batch-feature-legacy-audit-001", "inputs": ["feature-development stub", "legacy-recovery stub", "project-audit stub"], "outputs": ["feature-development v1.1.0", "legacy-recovery v1.1.0", "project-audit v1.1.0"], "source_baseline": "git HEAD pre-expansion", "verification": {"axiom_cli_repo_validate": "PASS", "pytest": "6 passed", "verify_skill": "PASS x3"}}
