{"action": "rebuild-universal-interfaces-v1", "agent": "skill-implementer", "approval": {"human_review_required": false}, "id": "feature-interfaces-002", "inputs": ["b11 spec (lost sources; only __pycache__ survived)", "committed tree: engage.py, skill-index.json, main.py"], "outputs": ["packages/axiom_sdk", "packages/axiom_mcp/server.py", "packages/axiom_server/server.py", "axiom mcp/serve commands", "clients/mcp.json+COPILOT.md+CURSOR.md", "docs/client-matrix.md", "docs/adr/0005", "tests/test_interfaces.py"], "source_baseline": "branch feature/universal-interfaces from skill_v1", "verification": {"axiom_cli_repo_validate": "PASS", "pytest": "pending", "slice": "automotive/mcu = 42 skills"}}
