{"action": "expand-skill-embedded-linux-v1.1.0", "agent": "skill-implementer", "approval": {"human_review_required": false}, "id": "embedded-linux-expand-001", "inputs": ["skills/embedded-linux/SKILL.md v1.0.0 stub", "phase2-findings.json entries 8 (Yocto)"], "outputs": ["skills/embedded-linux/SKILL.md v1.1.0", "skills/embedded-linux/manifest.yaml v1.1.0"], "source_baseline": "git HEAD pre-expansion", "verification": {"axiom_cli_doctor": "PASS", "axiom_cli_repo_validate": "PASS", "pytest": "6 passed", "verify_skill": "PASS"}}
