{"action": "feature-skill-packaging-v1.2.0", "agent": "skill-implementer", "approval": {"human_review_required": false}, "id": "feature-packaging-001", "inputs": ["47 skills at v1.1.0 without frontmatter", "axiom_cli without engage/run", "no harness install path"], "outputs": ["47 skills at v1.2.0 with frontmatter", "registries/skill-facets.yaml + skill-index.json", "packages/skills/engage.py", "axiom engage + axiom run", "scripts/install_skills.py", "docs/using-skills.md", "docs/adr/0004", "tests/test_skills_packaging.py (4 tests)"], "source_baseline": "git HEAD pre-feature", "verification": {"axiom_cli_doctor": "PASS", "axiom_cli_repo_validate": "PASS", "pytest": "10 passed"}}
