{"action": "feature-simple-ui-ops-slice-1", "agent": "skill-implementer", "approval": {"human_review_required": false}, "id": "simple-ui-ops-001", "inputs": ["feature spec Simple UI Complex Automation", "user scope decisions (stdlib HTML, plan emitters, repo-health status)"], "outputs": ["packages/axiom_ops/__init__.py", "axiom status/fix/feature CLI", "serve / dashboard + /v1/status|fix|feature", "SDK re-exports + 3 MCP tools", "tests/test_ops.py", "docs/adr/0006-simple-ui-ops.md"], "source_baseline": "cli_skd HEAD pre-branch", "verification": {"axiom_cli_doctor": "PASS", "axiom_cli_repo_validate": "PASS", "pytest": "20 passed"}}
