{"action": "expand-skills-batch-assurance2-v1.1.0", "agent": "skill-implementer", "approval": {"human_review_required": true, "reason": "security and fault-injection are safety/security sensitive"}, "id": "batch-assurance2-001", "inputs": ["security stub", "fault-injection stub", "performance stub"], "outputs": ["security v1.1.0", "fault-injection v1.1.0", "performance v1.1.0"], "source_baseline": "git HEAD pre-expansion", "verification": {"axiom_cli_repo_validate": "PASS", "pytest": "6 passed", "verify_skill": "PASS (2 with human-review flag)"}}
