{"action": "expand-skill-safety-v1.1.0", "agent": "skill-implementer", "approval": {"human_review_required": true, "reason": "safety-sensitive content"}, "id": "safety-expand-001", "inputs": ["skills/safety/SKILL.md v1.0.0 stub", "phase2-findings.json entries 5,6,7"], "outputs": ["skills/safety/SKILL.md v1.1.0", "skills/safety/manifest.yaml v1.1.0"], "source_baseline": "git HEAD pre-expansion", "verification": {"axiom_cli_doctor": "PASS", "axiom_cli_repo_validate": "PASS", "pytest": "6 passed", "verify_skill": "PASS with human-review flag"}}
