{"action": "expand-skills-batch-cm-docs-release-v1.1.0", "agent": "skill-implementer", "approval": {"human_review_required": false}, "id": "batch-cm-docs-release-001", "inputs": ["configuration-management stub", "documentation stub", "release stub"], "outputs": ["configuration-management v1.1.0", "documentation v1.1.0", "release v1.1.0"], "source_baseline": "git HEAD pre-expansion", "verification": {"axiom_cli_repo_validate": "PASS", "pytest": "6 passed", "verify_skill": "PASS x3"}}
