{"action": "expand-skills-batch-languages-v1.1.0", "agent": "skill-implementer", "approval": {"human_review_required": false}, "id": "batch-languages-001", "inputs": ["embedded-c stub", "embedded-cpp stub", "rust-embedded stub"], "outputs": ["embedded-c v1.1.0", "embedded-cpp v1.1.0", "rust-embedded v1.1.0"], "source_baseline": "git HEAD pre-expansion", "verification": {"axiom_cli_repo_validate": "PASS", "pytest": "6 passed", "verify_skill": "PASS x3"}}
