{"action": "expand-skills-batch-bringup-build-testauto-v1.1.0", "agent": "skill-implementer", "approval": {"human_review_required": false}, "id": "batch-bringup-build-testauto-001", "inputs": ["hardware-bringup stub", "build-system stub", "test-automation stub"], "outputs": ["hardware-bringup v1.1.0", "build-system v1.1.0", "test-automation v1.1.0"], "source_baseline": "git HEAD pre-expansion", "verification": {"axiom_cli_repo_validate": "PASS", "pytest": "6 passed", "verify_skill": "PASS x3"}}
