{"action": "expand-skills-batch-platforms-v1.1.0", "agent": "skill-implementer", "approval": {"human_review_required": false}, "id": "batch-platforms-001", "inputs": ["mpu stub", "soc stub", "mpsoc stub"], "outputs": ["mpu v1.1.0", "soc v1.1.0", "mpsoc v1.1.0"], "source_baseline": "git HEAD pre-expansion", "verification": {"axiom_cli_repo_validate": "PASS", "pytest": "6 passed", "verify_skill": "PASS x3"}}
